{"meta":{"id":"bw_reservation_98ee0f6f79327684","schemaVersion":"boreal.runtime.v1","createdAt":"2026-06-27T15:13:47.007Z","updatedAt":"2026-06-27T15:14:02.214Z","createdBy":{"id":"cybertron","kind":"human","displayName":"cybertron"},"updatedBy":{"id":"cybertron","kind":"human","displayName":"cybertron"},"sourceRefs":[],"tags":[],"contentHash":"sha256:4b8dfb0b2948ceb0af050dd260ef30522dedd9b96892babb649129c2a1062dcf"},"workId":"bw_work_6fb7ac64b49e7742","agentId":"cybertron","status":"released","reservedAt":"2026-06-27T15:13:47.007Z","purpose":"complete Sprint 12 audit hardening task"}
