{"meta":{"id":"bw_reservation_caa0af869bd52389","schemaVersion":"boreal.runtime.v1","createdAt":"2026-07-01T13:42:46.292Z","updatedAt":"2026-07-01T13:50:15.995Z","createdBy":{"id":"cybertron","kind":"human","displayName":"cybertron"},"updatedBy":{"id":"cybertron","kind":"human","displayName":"cybertron"},"sourceRefs":[],"tags":[],"contentHash":"sha256:c5dc1283563b6b301f3c924286c2ff13703cbdf5f3ece72f146abb8e4f69cbe3"},"workId":"bw_work_c6e1d7bd372b2029","agentId":"cybertron","status":"released","reservedAt":"2026-07-01T13:42:46.292Z","expiresAt":"2026-07-01T17:42:46.224Z","purpose":"Implement S01T09 unsafe-content and registry lifecycle regression tests"}
