{"meta":{"id":"bw_reservation_8b7e66f55e29b8bc","schemaVersion":"boreal.runtime.v1","createdAt":"2026-07-02T05:54:41.442Z","updatedAt":"2026-07-02T06:05:11.923Z","createdBy":{"id":"cybertron","kind":"human","displayName":"cybertron"},"updatedBy":{"id":"cybertron","kind":"human","displayName":"cybertron"},"sourceRefs":[],"tags":[],"contentHash":"sha256:bef8cb02ee94e0b6415ddc546de6926f06422e458ef67a073710cde4b961ec6c"},"workId":"bw_work_6d84e592ce2e9e63","agentId":"cybertron","status":"released","reservedAt":"2026-07-02T05:54:41.442Z","purpose":"Collapse directive taxonomy"}
