{"meta":{"id":"bw_reservation_a5a09b9abf44734f","schemaVersion":"boreal.runtime.v1","createdAt":"2026-06-27T04:28:08.507Z","updatedAt":"2026-06-27T04:42:11.516Z","createdBy":{"id":"cybertron","kind":"human","displayName":"cybertron"},"updatedBy":{"id":"cybertron","kind":"human","displayName":"cybertron"},"sourceRefs":[],"tags":[],"contentHash":"sha256:2a949c03b7f86c41c1ce207cf67146adfaf69c2a876dd657ba6e0fbc65d71799"},"workId":"bw_work_b09849054f44389f","agentId":"cybertron","status":"released","reservedAt":"2026-06-27T04:28:08.507Z","purpose":"implement S05T06 global search and actor activity panels"}
