{"meta":{"id":"bw_reservation_cb986b274c6c9315","schemaVersion":"boreal.runtime.v1","createdAt":"2026-07-10T13:45:22.242Z","updatedAt":"2026-07-10T13:45:22.242Z","createdBy":{"id":"cybertron","kind":"human","displayName":"cybertron"},"updatedBy":{"id":"cybertron","kind":"human","displayName":"cybertron"},"sourceRefs":[],"tags":[],"contentHash":"sha256:918e52b558fedc49f6094830cf5745e2d998019fde705bbbbe9a868edb21a3c1"},"workId":"bw_work_f1500b41cca2c75c","agentId":"codex-search-hardening","status":"released","reservedAt":"2026-07-10T13:45:22.242Z","purpose":"agent finish one-shot"}
