{"meta":{"id":"bw_reservation_3ef6acaaff6fb5cb","schemaVersion":"boreal.runtime.v1","createdAt":"2026-07-04T05:47:08.182Z","updatedAt":"2026-07-04T05:58:16.056Z","createdBy":{"id":"cybertron","kind":"human","displayName":"cybertron"},"updatedBy":{"id":"cybertron","kind":"human","displayName":"cybertron"},"sourceRefs":[],"tags":[],"contentHash":"sha256:72d7d5104826c74d4804059dcbc5d7374a49587d5cf14fe925bca70eda0cca6a"},"workId":"bw_work_955684b17c4a9349","agentId":"cybertron","status":"released","reservedAt":"2026-07-04T05:47:08.182Z","purpose":"implement Hardening S3 mutation payload trimming"}
