{"meta":{"id":"bw_reservation_70bbd98794b563c7","schemaVersion":"boreal.runtime.v1","createdAt":"2026-07-01T15:38:14.087Z","updatedAt":"2026-07-01T15:43:45.519Z","createdBy":{"id":"cybertron","kind":"human","displayName":"cybertron"},"updatedBy":{"id":"cybertron","kind":"human","displayName":"cybertron"},"sourceRefs":[],"tags":[],"contentHash":"sha256:3ba2c5c0b58d883e3ecf2805d47fe2ac8686f81db329fbb00c6aff837b8a7a8c"},"workId":"bw_work_84aed5746b6e16e8","agentId":"codex","status":"released","reservedAt":"2026-07-01T15:38:14.087Z","expiresAt":"2026-07-01T19:38:13.985Z","purpose":"S02T08 handoff and workflow-next directive compiler implementation"}
