{"meta":{"id":"bw_reservation_974c09dc3831a619","schemaVersion":"boreal.runtime.v1","createdAt":"2026-07-01T05:10:01.352Z","updatedAt":"2026-07-01T05:10:19.154Z","createdBy":{"id":"cybertron","kind":"human","displayName":"cybertron"},"updatedBy":{"id":"cybertron","kind":"human","displayName":"cybertron"},"sourceRefs":[],"tags":[],"contentHash":"sha256:13898e58facdc4c4b1b2d027c63dcaa04b4aa447c57e085e9592950b06d65d7d"},"workId":"bw_work_1efee186fff31372","agentId":"cybertron","status":"released","reservedAt":"2026-07-01T05:10:01.352Z","expiresAt":"2026-07-01T07:10:01.283Z","purpose":"Close Phase 01B rollup after S01T04-S01T06 completion"}
