{"meta":{"id":"bw_reservation_2f0b82e24dc6bc7b","schemaVersion":"boreal.runtime.v1","createdAt":"2026-07-04T07:36:20.843Z","updatedAt":"2026-07-04T07:36:20.843Z","createdBy":{"id":"cybertron","kind":"human","displayName":"cybertron"},"updatedBy":{"id":"cybertron","kind":"human","displayName":"cybertron"},"sourceRefs":[],"tags":[],"contentHash":"sha256:35a0ed4cea61c3e8393141fc8d1f20b8d6d35911f3e2fe37f2a371fdb11678ac"},"workId":"bw_work_25f49d2c2a07c396","agentId":"cybertron","status":"released","reservedAt":"2026-07-04T07:36:20.843Z","purpose":"agent finish one-shot"}
