{"meta":{"id":"bw_reservation_8ac994d3dd372687","schemaVersion":"boreal.runtime.v1","createdAt":"2026-06-27T10:31:01.484Z","updatedAt":"2026-06-27T10:33:49.848Z","createdBy":{"id":"cybertron","kind":"human","displayName":"cybertron"},"updatedBy":{"id":"cybertron","kind":"human","displayName":"cybertron"},"sourceRefs":[],"tags":[],"contentHash":"sha256:130715ea5404401925eae12f5b29cdcd390d763655da1ad2ad5e20bb2c5f197a"},"workId":"bw_work_7d32023f7bd48de3","agentId":"codex","status":"released","reservedAt":"2026-06-27T10:31:01.484Z","expiresAt":"2026-06-27T14:31:01.443Z","purpose":"MCP leakage and traversal test plan"}
