{"meta":{"id":"bw_reservation_e571b2873f6fce5c","schemaVersion":"boreal.runtime.v1","createdAt":"2026-06-27T03:34:46.864Z","updatedAt":"2026-06-27T03:34:57.193Z","createdBy":{"id":"codex-sprint05-collision-check","kind":"agent","displayName":"codex-sprint05-collision-check"},"updatedBy":{"id":"codex-sprint05-collision-check","kind":"agent","displayName":"codex-sprint05-collision-check"},"sourceRefs":[],"tags":[],"contentHash":"sha256:6bf2fc7bdda42ce74dea2276dde62b076ebd96e8fc3a89316d6c5c93f6a84a2b"},"workId":"bw_work_b12e989965546764","agentId":"codex-sprint05-collision-check","status":"released","reservedAt":"2026-06-27T03:34:46.864Z","expiresAt":"2026-06-27T03:44:46.822Z","purpose":"collision check only: verify reserved Sprint 05 work is skipped"}
