{"meta":{"id":"bw_reservation_60dfc775a1b40eee","schemaVersion":"boreal.runtime.v1","createdAt":"2026-07-07T16:02:37.916Z","updatedAt":"2026-07-07T16:02:53.504Z","createdBy":{"id":"cybertron","kind":"human","displayName":"cybertron"},"updatedBy":{"id":"cybertron","kind":"human","displayName":"cybertron"},"sourceRefs":[],"tags":[],"contentHash":"sha256:911cf0934c61c0f458e23be5505d579f763c49de8fe51886df00ba4ab42ab0e3"},"workId":"bw_work_31589ea96f95e0be","agentId":"cybertron","status":"released","reservedAt":"2026-07-07T16:02:37.916Z","purpose":"close sprint G4 after all rollup contract and aggregation children are verified"}
