{"meta":{"id":"bw_reservation_cea4cb9197068324","schemaVersion":"boreal.runtime.v1","createdAt":"2026-06-27T01:58:48.372Z","updatedAt":"2026-06-27T01:58:48.584Z","createdBy":{"id":"codex-sprint02-executor","kind":"agent","displayName":"codex-sprint02-executor"},"updatedBy":{"id":"codex-sprint02-executor","kind":"agent","displayName":"codex-sprint02-executor"},"sourceRefs":[],"tags":[],"contentHash":"sha256:441bed07d0990386609a5110c95c14cb2d50be0cff98de18e78666cb03100ae1"},"workId":"bw_work_27c391ede42960e8","agentId":"codex-sprint02-executor","status":"released","reservedAt":"2026-06-27T01:58:48.372Z","expiresAt":"2026-06-27T03:58:48.347Z","purpose":"close Sprint 02 CLI dashboard primitives and installer UX"}
