{"meta":{"id":"bw_reservation_a2bf199f0f9cf56e","schemaVersion":"boreal.runtime.v1","createdAt":"2026-07-04T07:38:58.113Z","updatedAt":"2026-07-04T07:38:58.113Z","createdBy":{"id":"cybertron","kind":"human","displayName":"cybertron"},"updatedBy":{"id":"cybertron","kind":"human","displayName":"cybertron"},"sourceRefs":[],"tags":[],"contentHash":"sha256:d910af67a283e1af0f351e735b4ea754dad536cf7b7e0c3ddbd2b71781ce0db6"},"workId":"bw_work_750a67aa09e8ebd9","agentId":"cybertron","status":"released","reservedAt":"2026-07-04T07:38:58.113Z","purpose":"agent finish one-shot"}
