{"meta":{"id":"bw_reservation_27236bbc9ae9fffe","schemaVersion":"boreal.runtime.v1","createdAt":"2026-06-27T10:22:16.290Z","updatedAt":"2026-06-27T10:27:35.866Z","createdBy":{"id":"cybertron","kind":"human","displayName":"cybertron"},"updatedBy":{"id":"cybertron","kind":"human","displayName":"cybertron"},"sourceRefs":[],"tags":[],"contentHash":"sha256:6de9316c404311fa905041469ed47a1330870bb05509a77eba8328e83676aa52"},"workId":"bw_work_ef04fdb0a62c9d89","agentId":"codex","status":"released","reservedAt":"2026-06-27T10:22:16.290Z","expiresAt":"2026-06-27T14:22:16.250Z","purpose":"MCP resource boundary and project-root guard"}
