{"meta":{"id":"bw_reservation_41d8f85bbfb39475","schemaVersion":"boreal.runtime.v1","createdAt":"2026-07-02T20:18:41.670Z","updatedAt":"2026-07-02T20:29:52.752Z","createdBy":{"id":"cybertron","kind":"human","displayName":"cybertron"},"updatedBy":{"id":"cybertron","kind":"human","displayName":"cybertron"},"sourceRefs":[],"tags":[],"contentHash":"sha256:b0d57b89ef8fb19811c9ab9ed491bd4aa9aee963e939f5d2737aa239e171141c"},"workId":"bw_work_de6bb36f0e71ba78","agentId":"gm-wave5-1","status":"released","reservedAt":"2026-07-02T20:18:41.670Z","purpose":"close Sprint G2 packaging install track"}
