{"meta":{"id":"bw_reservation_ea13e8d4675849e1","schemaVersion":"boreal.runtime.v1","createdAt":"2026-07-10T13:44:56.365Z","updatedAt":"2026-07-10T13:44:56.365Z","createdBy":{"id":"cybertron","kind":"human","displayName":"cybertron"},"updatedBy":{"id":"cybertron","kind":"human","displayName":"cybertron"},"sourceRefs":[],"tags":[],"contentHash":"sha256:2b3eaa79f389959007b7bcc7436bddaaa29c887c0aac7a8d78da12640d89e1ce"},"workId":"bw_work_3c962ef6c33a101d","agentId":"codex-search-hardening","status":"released","reservedAt":"2026-07-10T13:44:56.365Z","purpose":"agent finish one-shot"}
