{"meta":{"id":"bw_reservation_da437b2a5272f764","schemaVersion":"boreal.runtime.v1","createdAt":"2026-07-10T13:48:29.138Z","updatedAt":"2026-07-10T14:00:30.133Z","createdBy":{"id":"cybertron","kind":"human","displayName":"cybertron"},"updatedBy":{"id":"cybertron","kind":"human","displayName":"cybertron"},"sourceRefs":[],"tags":[],"contentHash":"sha256:b5e4e8d0d0f42101d03cf9094e9718db8d81b19d85a4b2b4e07731d35db5ec47"},"workId":"bw_work_3cc50623d36aa119","agentId":"codex-ci-hardening","status":"released","reservedAt":"2026-07-10T13:48:29.138Z","purpose":"Add runtime tests and fixture-backed strict doctor PR gates"}
