{"meta":{"id":"bw_reservation_e11fc748eb99a304","schemaVersion":"boreal.runtime.v1","createdAt":"2026-06-27T09:06:37.208Z","updatedAt":"2026-06-27T09:14:56.803Z","createdBy":{"id":"cybertron","kind":"human","displayName":"cybertron"},"updatedBy":{"id":"cybertron","kind":"human","displayName":"cybertron"},"sourceRefs":[],"tags":[],"contentHash":"sha256:df1dea109b645c91e4637c48ea25c488a682c5e938acb2dff2634e98a65069aa"},"workId":"bw_work_c85cf267e9a20c67","agentId":"cybertron","status":"released","reservedAt":"2026-06-27T09:06:37.208Z","purpose":"implement S08T02 SQLite generated cache adapter"}
