{"meta":{"id":"bw_reservation_af35093fbb5e78c6","schemaVersion":"boreal.runtime.v1","createdAt":"2026-07-05T21:18:06.235Z","updatedAt":"2026-07-05T21:34:59.124Z","createdBy":{"id":"cybertron","kind":"human","displayName":"cybertron"},"updatedBy":{"id":"cybertron","kind":"human","displayName":"cybertron"},"sourceRefs":[],"tags":[],"contentHash":"sha256:bd52fc80bf826e9708fc05fc9e7f641452965661e73a8a234bf298cf90790ecb"},"workId":"bw_work_a144a8bd521545ab","agentId":"cybertron","status":"released","reservedAt":"2026-07-05T21:18:06.235Z","purpose":"T11 global status command"}
