{"meta":{"id":"bw_reservation_d47dec2d41c34ad3","schemaVersion":"boreal.runtime.v1","createdAt":"2026-07-02T05:52:06.547Z","updatedAt":"2026-07-02T05:52:14.314Z","createdBy":{"id":"cybertron","kind":"human","displayName":"cybertron"},"updatedBy":{"id":"cybertron","kind":"human","displayName":"cybertron"},"sourceRefs":[],"tags":[],"contentHash":"sha256:d92aff976839253d0b6842a47afd6570534a75c4201d49f2984c6dc497bb7539"},"workId":"bw_work_e1165682f096d0c0","agentId":"cybertron","status":"released","reservedAt":"2026-07-02T05:52:06.547Z","purpose":"Close Sprint 2 enforcement gap contract rollup"}
